{
  "apiVersion": "acorn.dev/event/v2",
  "eventId": "01935c8a-2c9a-7ded-bc7f-c28e61d82d12",
  "nodeId": "01935c7a-20d2-7a34-baf4-72df9230e3b1",
  "sequence": "982",
  "type": "acorn.core.task.renamed.v2",
  "schema": {
    "uri": "https://acorn.dev/schemas/events/v2/task-renamed.json",
    "digest": "sha256:1111111111111111111111111111111111111111111111111111111111111111",
    "version": 2
  },
  "resource": "acorn://01935c7a-20d2-7a34-baf4-72df9230e3b1/task/01935c7e-b85d-7a98-aeac-d7710ca27f87",
  "producer": {
    "kind": "core",
    "coordinate": "acorn/core",
    "version": "2.0.0",
    "generation": null
  },
  "actor": {
    "kind": "device",
    "id": "01935c80-c269-788e-9bbb-bb783789fcff",
    "delegation": null
  },
  "commandId": "01935c89-8a43-7f22-95cb-8b9a04b37282",
  "correlationId": "01935c89-8a43-7f22-95cb-8b9a04b37282",
  "causationId": "01935c89-8a43-7f22-95cb-8b9a04b37282",
  "occurredAt": "2026-07-30T04:14:58.231Z",
  "recordedAt": "2026-07-30T04:14:58.232Z",
  "sensitivity": "internal",
  "payload": {
    "revision": "13",
    "name": "Review event protocol"
  }
}
